"answerCount","answers","creationTime","id","index","qid","title","url"
"10","We’re not sure. We are sure that the companies that profit from the sale of GM foods are the same companies that (i) design, (ii) conduct, and (iii) evaluate the tests to determine if the GM foods are ‘safe.’ When you think about that relationship, you need to apply Critical Thinking.Be very careful when people tell you that selective breeding is the same as GM foods. They’re not the same: the former is pairing organisms with certain traits on a macroscopic scale, the later is making alterations on a microscopic scale.By analogy, taking a train from Brussels to Paris is not the same as walking from Brussels to Paris. In fact, unless you’re lucky or you do an extensive amount of planning, you’re not even going to end up in the same place.…. and that’s a problem. No one has proven that you end up in the same place whether you do selective breeding or genetic modifications. Many people will claim that, but no one has proven it.Critical Thinking is important. Please apply Critical Thinking liberally.","2018-09-17T20:58:24.928Z","UXVlc3Rpb25AMDozNDQ2MTg3MA==","11","34461870","Do you believe that non GMO foods are actually better for your health than GMO?","https://www.quora.com/Do-you-believe-that-non-GMO-foods-are-actually-better-for-your-health-than-GMO"
"11","GMO Genetically modified organism, a plant generally who has had a gene or multiple genes changed somehow by man.This can be done through traditional breeding or gene modification in a lab or both.Usually the term is used in a derogatory way lumping all gene changes into some evil attempt to play god.In truth gene modification can provide disease resistance, drought, frost resistance, herbicide tolerance meaning 1 pesticide is used instead of multiple ones. A safer pesticide is used versus a deadly one. A climate change flexible crop can be grown. One that can grow on reclaimed soil. One that is cheaper than organic or traditional crop varieties on the shelf making food security less of an issue, fresh produce more available than canned or frozen and I go on…What is the effects of consumption. On the negative side gene modification has been done for 30+ years with no credible scientific studies showing negative effects on human and livestock health. None!Lots of internet studies, testimonials, anecdotal evidence. Reports are widespread just digging into the stories finds they are….just.. stories. Someone is selling something, usually it is organic, or hormone free, no antibiotics, PETA or Green Peace memberships, vegetarian or vegan etc etc.","2019-03-09T21:08:33.716Z","UXVlc3Rpb25AMDo0MzYxOTEwOQ==","12","43619109","What is the health implication of consuming GMO foods?","https://www.quora.com/What-is-the-health-implication-of-consuming-GMO-foods"
"15","Assuming that “GMO” refers to a Genetically Modified Organism (plant), the harm is very likely to be the chemical residue(s) from what was applied to the plant before harvest. Farmers are tempted to spray/dust crops generously because they think that will increase their harvest, and this is very likely true.But those chemicals have their own effects on/in our bodies if we consume them. They may be located within the plant, e.g., a potato, which is an underground stem, and thus be impossible to wash off.American agriculture has depended on the assumption that it didn’t matter what was applied to growing crops because no toxic potential would remain by the time the food was on the table. We now know that this assumption is invalid; many of those chemicals have the capability to harm us as well.","2016-12-30T03:05:35.755Z","UXVlc3Rpb25AMDoxMTk1MjcyNQ==","13","11952725","How do genetically modified foods or GM affect the human body?","https://www.quora.com/How-do-genetically-modified-foods-or-GM-affect-the-human-body"
"7","Because they’ve been told over and over again by sources they trust that it is.Unfortunately, those sources are not trustworthy. They have done nothing to verify the scare-mongering rubbish that they publish, and often they feed off each other without looking for any new information at all.It’s important to distinguish among the various forms of GE. The safety of Roundup-ready crops can’t be compared with that of crops integrating genes from Bacillus thuringia, since the former requires the use of even heavier doses of a human-toxic herbicide (Roundup) than regular crops of the same species do, while the latter require little or no pesticide use unlike the traditional crops of the same species.Anyone who reads the actual science published in reputable, peer-reviewed journals will understand that what they call GMOs (genetically-modified organisms) are just the latest in a long line of organisms genetically modified by humans that began when agriculture started, thousands of years ago. Farmers have always used various tools to do this, and now they have tools that originate in labs to use as well. That’s all it is.Because of the fears expressed by people who can’t or won’t understand the real science of it, any newly-modified organism that has been produced by lab techniques instead of the older breeding techniques is exhaustively tested before being made available to farmers. So you can be quite certain that even if there were something to fear in the whole GE matter, which there is not, then whatever organisms make it into the fields are totally safe, something that can’t be said for the products of all the older techniques that have not been tested.Here are a few references to real science instead of uninformed fear:A Nature article about the induced controversy and the deceitful techniques used to spread fear of GE: Scientists avert new GMO crisisA Science article about the benefits and safety of growing GMOs: Plant Biotechnology in Chinahttp://www.sciencedirect.com/science/article/pii/S0167779909000511An overview of the last 10 years of genetically engineered crop safety researchIn case the question changes, the one I answered was:“Why do people think that GMO is bad for your health?I think it is”","2017-03-30T15:08:10.273Z","UXVlc3Rpb25AMDoxMzk5OTU5OQ==","14","13999599","Why do people think that GMO is bad for your health?","https://www.quora.com/Why-do-people-think-that-GMO-is-bad-for-your-health"
"10","Literally nothing, no GMO has ever been found to be harmful over forty years of research and with billions consuming them daily. Not only are they extremely safe beyond any reasonable doubt, but they also have the potential to save the million or more people that die from starvation and the half-million or more that permanently lose their eyesight from malnutrition every year. A GMO is simply a food derived from an organism that has had it’s DNA altered somehow to make it bigger, tastier, heat resistant, cold resistant, etc. The way DNA is altered today is by using enzymes (little chemically active proteins) to cut open DNA and insert DNA from a different organism that has a desirable gene. That DNA they inserted is foreign and therefore people think that this must mean that it’s harmful in someway. However, while the DNA is foreign, it is still just DNA and acts just as it did in the (also edible and nonharmful usually) animal that it was taken from. Any organism you consume (plant or animal) has DNA in it anyway which still isn’t harmful… you could litteraly drink the stuff. If the DNA inserted coded for something toxic to humans then it probably wouldn’t be labeled as safe to eat by the FDA.People say that GMOs “must” be harmful but that’s just it; these are just random people not scientists. No credible Scientist has ever said that GMOs are harmful. That’s not to say there weren’t/arn’t some crackpot conspiricy theorists parading around as scientists who ignore the scientific method to obtain largely falsified results that suit the imaginary point they’re trying to prove. There are a few commonly cited “studies” that suposedly prove that GMO’s cause health defect but absolutely none of them are recognized by the National Academies of Science, Engineering, and Medicine who concluded that “no substantiated evidence that foods from GE crops [are] less safe than foods from non-GE crops [exists].” One notable example is a study that claimed to have found evidence that mice fed GMO’s developed tumors due to their diet. That study was complete bs for a few reasons; it had no control group (genetically similar mice fed non-GMO food to establish that the mice didn’t just commonly grow tumors anyway) which was probably because the breed of lab mouse he used is highly predisposed to growing tumors.The only logical argument against GMOs is that while known GMOs are safe, in theory, new and untested ones might not be (heavy emphasis on the “in theory”) However, any genetically modified crop released to consumers in any country has been tested and approved by the food and drug administration, any scientist who is cautious of GMO’s is really only cautious (with good reason) about the relaxation of the laws regarding the testing and certification of GMOs. The reason many popular chains like whole foods swear off GMOs is because it’s a publicity stunt and a marketing technique (if you think they’re above that, then you should look at that time they sold a bottle of water with asparagus in it for $8 each).A poll by the Pew Center in 2015 which found that 88% of scientists think that GM crops are safe while only 37% of the public agrees; this is the largest gap in opinion between the scientific community and the public over any existing issue, including climate change.TL;DR Nothing.I got a 5 on the AP Biology exam, I got a 5 on the AP Statistics exam, and I had the privilage of writing a research paper on GMOs in AP Language and composition.","2017-12-11T22:17:17.653Z","UXVlc3Rpb25AMDoyMTY2MTUyMA==","15","21661520","Exactly what is it about GMO foods that can endanger your health?","https://www.quora.com/Exactly-what-is-it-about-GMO-foods-that-can-endanger-your-health"
"2","The notion that GMOs are inherently more likely to cause health problems than traditional crops is bogus pseudoscience promoted by 'studies' funded by European agribusiness, including Carforre. (The scientists accepting funding from Auchan and Carforre unethically failed to disclose the source.)Auchan and Carrefour financed CRIIGEN studies on GMOs.The CRIIGEN studies, and others like them, deliberately present misleading conclusions. It's possible to criticize particular GMO crops. But I can also tell stories about conventionally bred crops which caused health problems. For example; A strain of traditionally bred celery was high in furanocoumarins, and the people who handled the stuff got a rash which was worse than poison ivy. There is no evidence that the process of genetic modification itself causes health issues. (Admittedly,  I'm frustrated by the fact that antibiotic resistance genes which would confer resistance to clinically used antibiotics are still used in the process of genetic modification. There's no scientific support that I'm aware of that this technique promotes antibiotic resistance, but it's stupid to take the risk when there are other ways to do genetic modification.)Modern agriculture requires the periodic introduction of new crop varieties to prevent various pathogens and parasites becoming too well adapted to particular varieties so you'd have introduction of new germ material, by necessity, even with conventional breeding. Conventional breeding techniques actually introduce far MORE uncertainty into the world's food supply.If you really wanted to make a scientifically accurate case against GMOs you shouldn't focus on the notion of genetic modification, per se. Most of the things that can be done with genetic modification can also be done with conventional breeding and there's zero evidence that genetic modification causes health issues of any kind. 
Instead, focus on the perverse economic incentives that exist in agriculture and what it would mean if those incentives were satisfied at a faster rate. For example; if it were possible to create food with a longer shelf life then the produce would sit in the store longer. If it's possible to grow food which is more resistant to pesticide, then more pesticide might be applied. Would genetic modification speed up the rate that this happens at? Ask any farmer how they choose their crops. They'll talk about disease resistance or time to harvest. Taste or nutritional value are typically not on the list of criteria when they decide what to plant. Purchasers of juicing oranges make their decisions primarily on the sugar content of the oranges (since that's a proxy for ripeness.) And those incentives are a problem, regardless of how the crop is produced.But these problems won't be solved by eliminating GM crops, only slowed down. The incentives themselves need to be changed.","2013-08-03T00:10:49.666Z","UXVlc3Rpb25AMDoxMjYwMjUz","16","1260253","What are some scientifically valid points for GMO's causing health problems? Both in humans or animals.","https://www.quora.com/What-are-some-scientifically-valid-points-for-GMOs-causing-health-problems-Both-in-humans-or-animals"
"3","Genetically modified organisms are plants that have novel genetics often outside the plant kingdom, inserted into the nucleus in seeds via a gene gun. This is very different from hybridization where two or more parents from the same species are used to produce seed that grows into a plant.One can turn a open pollinated plant such as soya, as well as F1 hybrids such as dent or sweet corn into GMOs.Some GMOs are bad for health as they have the wrong sized proteins but most of the time those GMOs are screened out and never hit the food stream. GMOs are bad for soil health as they demand a monoculture and a lot of herbiocode use to get that monoculture which kills the soil and leaves it open to a lot of erosion and flooding, but I don’t think you are asking that question. As far as human health GMOs are not bad for humans other then they are used in highly processed foods that are way too high in salt, fat and sugars causing obesity, high cholesterol and a diabetes in a huge portion of the population. though most of the corn and soya GMOs are used for livestock feed and industrial uses such as lubricants","2022-04-24T11:03:41.824Z","UXVlc3Rpb25AMDoxMTYxMTUyODk=","17","116115289","What is the difference between GMO and non-GMO? Is GMO bad for your health?","https://www.quora.com/What-is-the-difference-between-GMO-and-non-GMO-Is-GMO-bad-for-your-health"
"7","The human health has been changing but GMO produce while coincidental, have yet to be substantively linked to this decline at all.Over all health has been linked to obesity, most likely from an increase in processed foods, coupled with a more stationary life-style, as well as environmental degradation and simply too many people.","2019-07-02T23:02:07.846Z","UXVlc3Rpb25AMDo1MTU0MDUxNQ==","18","51540515","Has human health declined with the introduction of GMO produce?","https://www.quora.com/Has-human-health-declined-with-the-introduction-of-GMO-produce"
"7","Unless you gather wild plants and hunt wild animals (well actually hunting and fishing causes animals to evolve, like severe fishing with legal size limits makes dwarf mutants that are sexually mature but below the size limit have a survival advantage), everything you eat has been modified even inadvertently by man in some way.This is done through domestication, hybridization, natural mutation in the old days to mutation breeding (yep there are varieties of “organic”crops that were made in a laboratory) and genetic engineering.Natural does not necessarily mean healthier, and modified by man either through old or new methods does not necessarily mean less healthy. Rapeseed has erucic acid, which is poisonous. So man invented canola which is highly modified. Yes, canola is only a few decades old. Cassava produces cyanide which poisons people from time to time, and in small doses has other bad effects. But there are different varieties which contain much less to no cyanide.What about other more common vegetables? Well look at it this way. Cassava produces cyanide probably as a defence against organisms that like to eat its leaves. Pretty much every other plant including vegetables do this. Tomatoes are part of the Solanaceae family which includes the nightshade plants. So its no mystery where in the family the tomato gets its chemical warfare genes.Okay, simple logic. If you are a tomato (or whatever plant) farmer from long ago before pesticides, how do you propagate your crop? Simple, you get the plants which yield more then plant their seeds or whatever. And how do those plants yield more? Before pesticides this means the plants produce their own. Yup, those things on your dinner plate are the winners of thousands of years of evolution where pests eat the plants. Only the strong or in this case only those who produce the strongest natural pesticides surviveThese pesticides obviously work otherwise many generations of farmers would no have saved and replanted the seeds. But how healthy are they for you? Are there any safety tests that prove that they are healthy?We calculate that 99.99% (by weight) of the pesticides in the American diet are chemicals that plants produce to defend themselves. Only 52 natural pesticides have been tested in high-dose animal cancer tests, and about half (27) are rodent carcinogens; these 27 are shown to be present in many common foods.Dietary pesticides (99.99% all natural).To answer your question, no. GMO and non GMO foods have equal potential to be either good or bad for you, its the specific details that matter. But a lot of people spread the lie the natural is good for you in order for them to be able to sell more of their products.One criticism of GMO is that a lot of GMO plants are designed to be herbicide resistant and this promotes the use of that herbicide and the herbicide may be bad for you. Well the evidence that it is bad for you is suspect. But even if it were one day proven to be bad for you, thats specific to that herbicide and since you can have GMO’s without that herbicide then it is not a condemnation of GMO’s as a whole.Also, so called “organic” produce has the potential problem of natural carcinogens made by the plant itself as well as the fact that “organic” produce can use old fashioned herbicides and pestdicides that are also toxic and since they are less potent, more are used.","2018-08-21T11:11:15.668Z","UXVlc3Rpb25AMDozMzIwMjM4Ng==","19","33202386","Does eating non-GMO food really improve your health?","https://www.quora.com/Does-eating-non-GMO-food-really-improve-your-health"
"5","People say there is no difference between (GMO and non-GMO) (Corn syrup and sugar) (organic and nonorganic) in terms of health. What is your opinion?These three separate questions with different answers!GMO – I’m not aware of any documented health difference between a GMO and its non-GMO relatives, except of course where the GMO variant has been specifically engineered for better nutrition, for instance rice with elevated vitamin A. A food product doesn’t ‘know’ or care what lab procedures led to its existence or the construction of its DNA. The old shotgun method was to induce mutation with UV or toxic chemicals and screen the mutations for valuable traits. The rifle-shot approach of a GMO more efficiently makes specific changes and then submits the new organism to rigorous testing and review. Give me GMOs, thank you.Corn syrup – It’s become fashionable to bash corn syrup. The recent ad from Anheuser Busch (owned by Belgium’s InBev) during the Superbowl was fun but a silly piling-on to this fad. There’s nothing wrong with corn syrup and you’d be very hard pressed to prove that sugar from cane or beet is better than that from corn. This is especially true in the case of beer, since the sugar is mostly fermented away to alcohol and carbon dioxide, and AB uses carbohydrate from rice instead of corn. Big deal.The bashing of corn syrup probably stems from extending the bashing of HFCS, high fructose corn syrup. Studies have implicated fructose in some health issues, and it may be true that fructose is less safe than glucose. But we don’t eat glucose. We eat sucrose, and do you know how much fructose is in sucrose? Half. We have an enzyme in our stomach called invertase that converts sucrose into its component sugars of glucose and fructose within minutes. Know how much fructose is in HFCS? About half. The two standard commercial HFCS products are 42% or 55% fructose. These are hard to distinguish from invert syrup, the result of invertase action on sucrose. (A small amount of HFCS90 is also made, but it’s not anywhere nearly as common as HFCS42 and 55.) The point is, choosing sugar over corn syrup does nothing to help you avoid fructose, which in turn is only weakly implicated in health issues that are correlated with chronic and excessive consumption. Is fructose really a problem if you’re not also over-consuming sugar and calories? I’m skeptical.Organic – There is no dispute that organic products are often healthier than their non-organic competition. Studies have shown generally lower levels of pesticides and herbicides, and occasionally higher levels of healthy nutrients in organic produce. We still cannot make a blanket statement that organic products are always better, though. Organic products are not uniformly “worth it”. A reasonable approach is to spend more for organic for the products where it matters more, which is often for products you don’t peel, such as strawberries.","2019-01-24T01:54:39.795Z","UXVlc3Rpb25AMDo0MTE4OTE0MA==","20","41189140","People say there is no difference between (GMO and non-GMO) (Corn syrup and sugar) (organic and nonorganic) in terms of health. What is your opinion?","https://www.quora.com/People-say-there-is-no-difference-between-GMO-and-non-GMO-Corn-syrup-and-sugar-organic-and-nonorganic-in-terms-of-health-What-is-your-opinion"
"10","GMOs are not a threat to anybody’s health.I don’t know how to quantify the reception they’ve gotten anywhere. I know, sadly, of cases where African nations have rejected free, life-saving food because of unfounded fears of GMO. Which means, in my book, that the organic food industry (which has been conducting a misinformation campaign against GMO for years) has blood on its hands.","2017-04-02T14:51:49.559Z","UXVlc3Rpb25AMDoxNDA3MjAzNg==","21","14072036","Are GMO foods a threat to global health? Have they gotten a warmer consumer reception in Europe than in Africa?","https://www.quora.com/Are-GMO-foods-a-threat-to-global-health-Have-they-gotten-a-warmer-consumer-reception-in-Europe-than-in-Africa"
"4","Well, we have had 25 years of consumption with no validated adverse effects on human health. Let’s add in that over a hundred Nobel laureates think they aren’t a problem after looking at the hundreds of scientific studies done on them.My thought is that any adverse effects from the gmo foods currently on the market are not likely at all.What the future will bring is hard to predict. I suppose that someone might use some new technology and/or find a regulatory loophole resulting in something problematic…..but that isn’t very likely for a number of reasons.First, gmo foods are usually regulated by at least two agencies, USDA and FDA. If they also have a pesticide effect then it is 3, adding in EPA. That is a lot of regulation. It will be hard to try and slip something past the system in the U.S.Second is the way new varieties are introduced into commerce. When a new variety is developed they don’t just plant the entire crop with it and hope that no one has a problem. They try it in test plots. Panels do taste tests (organoleptic studies). Do you really think huge billion dollar businesses just toss all their eggs into one basket without first testing the product first? It is a slow and deliberate process.Third is that gmo’s remain controversial. They are under the media microscope. Everyone will know that a new gmo product will be hitting the grocery stores and/or the salad bars of America. There is intense pressure to get it right or the producers get hurt financially and the sellers (grocery stores, restaurants, etc) will get slammed in the media costing a fortune. That is the main reason why gmo potatoes never made it commercially. The biggest buyer of potatoes is McDonalds and they said they would not use them because the bad press would be too costly. Personally that is a shame because a lot of neonicotinoid pesticide applications could have been prevented.Finally, the U.S. is a litigious society. If one person get’s hurt from a food product the lawyers will line for a huge payday suing everyone in the chain of production, distribution, and sales. It could run into the billions quickly.These are some of the reasons why there are so few gmo fruits and vegetables on the market today.The only other possibility where a gmo product causing adverse effects might make it to the shelves would be some form of radical bioterrorism.","2018-12-28T13:02:19.238Z","UXVlc3Rpb25AMDozOTY2NjY5MQ==","22","39666691","Do you think that consuming GMO foods will cause health issues?","https://www.quora.com/Do-you-think-that-consuming-GMO-foods-will-cause-health-issues"
