"answerCount","answers","creationTime","id","index","qid","title","url"
"3","Yes. Generally speaking, GM food is much better than the environment than conventional or organic.Most GM food is engineered to resist drought, so it needs less water; resist pests like viruses; or be used with smaller doses of more effective pesticides. (A common lie of anti-GMO fruitcakes is “GMO USES MORE PESTICIDES!!!!!!!” No. GM food is deigned to resist highly targeted, highly effective herbicides, so that you can use less of it.)Organic food in particular is particularly bad for the environment, as its lower yields mean more land must be used for the same amount of food, drastically increasing organic’s carbon footprint.GM roduce benefits the environment in a number of ways, primarily through lower pesticide use (another common lie of anti-GMO fruitcakes is “Organic farming uses no pesticides!!!!”—anyone who tells you this is a complete ignoramus, and you can forever ignore everything they say about food and farming).As I write this, a stalker on Quora is creating fake profiles that look just like mine to abuse and harass people. If you receive an abusive PM or comment, please check the profile carefully. It probably isn’t me.","2021-05-13T00:15:31.662Z","UXVlc3Rpb25AMDo5MjI1NzI2Ng==","23","92257266","Does GMO food affect the health of the environment?","https://www.quora.com/Does-GMO-food-affect-the-health-of-the-environment"
"4","What are the health effects on humans for GMO (mostly animals)? I would think: Loss of nutrition, that both humans and animals need to stay totally healthy. I believe the more assumption of GMOs will eventually affect DNA of humans as well as animals for the worst. Research say: The biggest threat caused by GM foods is that they can have harmful effects on the human body. It is believed that consumption of these genetically engineered foods can cause the development of diseases which are immune to antibiotics. This include animal as well.","2021-10-09T20:47:39.870Z","UXVlc3Rpb25AMDoxMDE5MzQ0MTM=","24","101934413","What are the health effects on humans for GMO (mostly animals)?","https://www.quora.com/What-are-the-health-effects-on-humans-for-GMO-mostly-animals"
"4","GMO are like all our other foods. They have pluses and minuses. Their advantages, depending on what mutation has been inserted are: improved resistance to drought, plant diseases, increased yields, etc. The commonality is farmers can grow more and the benefit is we can better feed a growing population, and the companies that have the patients can make money.When you ingest them, they are broken-down into their chemical components in the gut. The genes don’t get into the blood stream and mutate us. (Tho one worry is that something will turn out be be ‘more than we expect’—like kudzu).","2019-06-09T01:51:50.413Z","UXVlc3Rpb25AMDo0OTgwODUzOA==","25","49808538","Are GMOs good or bad for your health?","https://www.quora.com/Are-GMOs-good-or-bad-for-your-health"
"8","Every genetic intervention is different so the safety or otherwise of one tells you nothing about any of the others. But all of those intended as food crops were tested before they were released. So far there have been no credible reports of anyone being harmed by eating any GM foods. There isn’t any known reason for that to change.There is one GM food that is expected to have an effect on human nutrition. Golden rice carries a gene making a precursor to vitamin A. It has the potential to eliminate a deficiency disease in countries that rely on rice as a staple food. Opposition to GM foods in the first world has restricted its planting. Some third-world commentators have criticised this as ‘cultural imperialism.’Bigger crops of more nutritious foods will impoverish soil unless fertilisers are used. Agricultural runoff can then becomes a problem. Modifying plants to fix atmospheric nitrogen reduces the need for added fertiliser. That could lead to reduced pollution of waterways.Glyphosate-resistant crops allow weeds to be suppressed using a specific weedkiller. In the short term it allows farmers to use glyphosate which is the least toxic of the common weedkillers. But it does encourage the growth of resistant weeds and that will become a problem.It’s a complicated problem. Anyone who thinks there is a quick fix doesn’t understand it.","2023-03-16T10:11:20.781Z","UXVlc3Rpb25AMDoxNTYyNTg2NDQ=","26","156258644","Is genetically modified (GMO) food safe for consumption, and what are the long-term effects on human health and the environment?","https://www.quora.com/Is-genetically-modified-GMO-food-safe-for-consumption-and-what-are-the-long-term-effects-on-human-health-and-the-environment"
"1","There’s a lot of debate about the safety of GMO papaya that is grown in Hawaii. Some say they have introduced new allergens and some say they could harm the environment. Because I follow the precautionary principle, I like to stick to the non-GMO variety.","2018-10-27T08:37:07.341Z","UXVlc3Rpb25AMDozNjU1MjAxMQ==","27","36552011","Why are GMO papayas a health risk?","https://www.quora.com/Why-are-GMO-papayas-a-health-risk"
"4","This is actually 2 questions.Good v Bad is, AFAIK, determined by context.It is well-established that our knowledge of highly complex health interactions is minuscule, especially with regard to the gut biome.Most GMOs appear generally safe for most people, most of the time, over the short term.HOWEVER, the risk management surrounding GE technology does not appear appropriately commensurate with its potential, which is incredible (for benefit and harm).","2019-05-24T00:56:13.195Z","UXVlc3Rpb25AMDo0ODcxNzQ4MQ==","28","48717481","How does GMO hurt our health, and is it always bad?","https://www.quora.com/How-does-GMO-hurt-our-health-and-is-it-always-bad"
"4","This is a peculiar question. There’s no commercially available GMO wheat (yet), and thus no gluten from GMO sources (yet).GMO has no direct relevance to health, and GMO crops share the exact same nutritional characteristics as non-GMO varieties of the same cultivar.If an individual were sensitive to gluten, then whether the gluten came from a GMO source or not would not be relevant (in so far as there are no GMO traits that affect gluten). Gluten powder from non-GMO wheat would be exactly as harmful as from a GMO variety, if one existed, for people suffering from celiac sprue.It’s an open question as to whether or not there is such a thing as gluten sensitivity. While most physicians accept that some patients report discomfort, bloating, or other symptoms following consumption of gluten-containing products, placebo-controlled studies has been unable to show a relationship between gluten exposure and response, or evidence of inflammation in non-celiac patients in response to gluten. While the cause of gluten-sensitivity is unknown, it doesn’t appear to have anything to do with consuming gluten.","2018-09-09T16:43:33.355Z","UXVlc3Rpb25AMDozNDA5MjM1MQ==","29","34092351","Is non-GMO gluten powder okay for the health?","https://www.quora.com/Is-non-GMO-gluten-powder-okay-for-the-health"
"4","Are there really health risks posed by GMO products to humans?When properly managed, no. There is no evidence that any currently approved and marketed GMOs are any more or less safe for human consumption than their conventional alternatives. Any varieties that could potentially be dangerous (e.g. those containing peanut allergens) are not approved and are never sold.Can GMO crops cause cancer?No. There are no credible studies linking any currently marketed GMO to cancer. There are a couple of rat and pig studies that claim that Roundup Ready corn and Roundup itself causes cancer in rats, but in reality these studies all have a myriad of errors that make them incredibly unreliable. Small sample sizes, no controls, poor experimental design, cross-contamination between treatments, complete lack of dose response, the list goes on. The response of the scientific community has been overwhelmingly negative (i.e. they are trash studies). Some have even been retracted (which is about as bad as it gets). Really there is not even a theoretical mechanism for most GMOs to cause cancer to begin with.Are they causing bacteria to rapidly evolve?No, why would they? GMOs don’t have anything to do with bacteria. Even if there was a GMO to defend against a bacterial disease, pest resistance is something that naturally evolves no matter what you do. To blame the GMO would be like blaming the flu vaccine for the virus changing every year. If you mean glyphosate, well there are already bacteria resistant to that. That’s where the gene used in Roundup Ready crops came from after all.","2020-02-04T02:50:52.886Z","UXVlc3Rpb25AMDo2NTc2MjExOQ==","30","65762119","Are there really health risks posed by GMO products to humans? Can GMO crops cause cancer? Are they causing bacteria to rapidly evolve?","https://www.quora.com/Are-there-really-health-risks-posed-by-GMO-products-to-humans-Can-GMO-crops-cause-cancer-Are-they-causing-bacteria-to-rapidly-evolve"
